{
    "version": "1.0.0",
    "event_id": "550e8400-e29b-41d4-a716-446655440000",
    "timestamp_utc": "2026-08-31T10:00:00Z",
    "trace_id": "660e8400-e29b-41d4-a716-446655440001",
    "source_agent": "strategy_selector_v2",
    "signal": {
        "symbol": "BTCUSDT",
        "direction": "LONG",
        "confidence": 0.87,
        "regime": "TRENDING"
    }
}
